{
  "id": "nucleo-h745zi-q",
  "name": "ST NUCLEO-H745ZI-Q",
  "aliases": [],
  "chip_id": "stm32h745zit6",
  "clock_sources": {
    "stlink_mco_hse_default": 8000000,
    "hse_x2_crystal": 25000000,
    "lse_x3_default": 32768
  },
  "reserved_pins": [],
  "source_references": [
    {
      "title": "ST NUCLEO-H745ZI-Q data brief",
      "url": "https://www.st.com/resource/en/data_brief/NUCLEO-H745ZI.pdf"
    },
    {
      "title": "ST NUCLEO-H745ZI-Q product page",
      "url": "https://www.st.com/en/evaluation-tools/nucleo-h745zi-q.html"
    },
    {
      "title": "ST MB1363 board user manual",
      "url": "https://www.st.com/resource/en/user_manual/dm00499171-stm32h7-nucleo144-boards-mb1363-stmicroelectronics.pdf"
    }
  ],
  "generation_available": false,
  "record_note": "The MB1363 H745 board uses 8 MHz ST-LINK MCO as default HSE; UM2408 also documents a 25 MHz X2 HSE crystal path and a default 32.768 kHz X3 LSE crystal. HSE can be changed by solder-bridge configuration and ST-LINK firmware. Board revision, dual-core startup, pin reservations, and build/flash profiles remain open; ST lists this SKU out of production.",
  "source_verified_fields": [
    "board_identity",
    "chip_binding",
    "clock_sources",
    "onboard_debugger"
  ],
  "onboard_devices": [
    {
      "name": "STLINK-V3E",
      "function": "On-board SWD debugger/programmer, mass-storage interface, and virtual COM port"
    }
  ]
}
