{
  "id": "arduino-nano-every",
  "name": "Arduino Nano Every (ABX00028)",
  "aliases": [
    "Nano Every"
  ],
  "chip_id": "atmega4809-afr",
  "clock_sources": {},
  "reserved_pins": [
    "PB04",
    "PB05",
    "PA14"
  ],
  "source_references": [
    {
      "title": "Arduino Nano Every ABX00028 datasheet",
      "url": "https://docs.arduino.cc/resources/datasheets/ABX00028-datasheet.pdf"
    },
    {
      "title": "Arduino Nano Every hardware documentation",
      "url": "https://docs.arduino.cc/hardware/nano-every"
    },
    {
      "title": "Arduino Nano Every schematic",
      "url": "https://docs.arduino.cc/resources/schematics/ABX00028-schematics.pdf"
    }
  ],
  "generation_available": false,
  "record_note": "The ATmega4809 is specified to run up to 20 MHz. The ATSAMD11D14A is the USB bridge and controls UPDI programming; PB04, PB05, and PA14 are occupied by these connections. The board documentation does not identify a single external main-clock source, so clock_sources stays empty. Build/flash profiles remain open.",
  "source_verified_fields": [
    "board_identity",
    "chip_binding",
    "main_cpu_max_frequency",
    "usb_bridge",
    "reserved_pins"
  ],
  "onboard_devices": [
    {
      "name": "ATSAMD11D14A",
      "function": "USB-to-UART bridge and ATmega4809 UPDI programming controller",
      "target_pins": [
        "PB04",
        "PB05",
        "PA14"
      ],
      "notes": "PB04/PB05 carry the bridge UART and PA14 carries the UPDI connection. The board datasheet notes level shifters between the 3.3 V bridge and 5 V AVR."
    }
  ]
}
